{"effective_at":"2026-07-19T23:00:00.000Z","identity_manifest_id":"idm_11111111-1111-4111-8111-111111111111","integrity":{"canonicalization":"RFC8785","key_id":"sha256:bfd16b896c8320ae199b684cdb03c6bb39d062442e4352fd4a2275ae1d826c70","payload_sha256":"sha256:24cbe65ba2754d793e08b1c69352ec152a879f633f8a39a8dcdfc3ae63b606cf","signature_algorithm":"ecdsa-p256-sha256-der-low-s","signature_base64":"MEUCIQD2aIFNtVutcIjdv2lWpnEpzqm7+WMX5OX17dWEn5bfWgIgWClVTV8Jz8T3x/FV0OdhBO8PpozSG/bh/lTHIKA0c0c="},"issued_by":{"installation_id":"ins_eeeeeeee-eeee-4eee-8eee-eeeeeeeeeeee","key_id":"sha256:bfd16b896c8320ae199b684cdb03c6bb39d062442e4352fd4a2275ae1d826c70"},"kind":"echo-publication-policy","organization_id":"org_aaaaaaaa-aaaa-4aaa-8aaa-aaaaaaaaaaaa","policy_id":"pol_33333333-3333-4333-8333-333333333333","publication":{"audience":{"scope":"organization","subjects":[{"id":"org_aaaaaaaa-aaaa-4aaa-8aaa-aaaaaaaaaaaa","kind":"organization"}]},"participant_observations":"included-namespaced","payload_scope":"approved-signal-with-meeting-context-brief-digest-and-bounded-evidence","raw_meeting_content":"local-only","retention":{"kind":"indefinite"},"sensitivity":"internal"},"schema_version":1,"version":1}